<?xml version="1.0" encoding="UTF-8"?>
<list enabled="true" xmlns:xsi="http://www.w3.org/2001/XMLSchema-instance" xsi:noNamespaceSchemaLocation="../../xsd/spawns.xsd">
	<spawn name="23_17">
		<npc id="20956" x="107424" y="-894" z="-3132" heading="58336" respawnDelay="37" /> <!-- Past Knight -->
		<npc id="20956" x="107829" y="-2001" z="-3252" heading="55665" respawnDelay="37" /> <!-- Past Knight -->
		<npc id="20956" x="109591" y="-2053" z="-3453" heading="43651" respawnDelay="37" /> <!-- Past Knight -->
		<npc id="20956" x="109677" y="-3" z="-3610" heading="13159" respawnDelay="37" /> <!-- Past Knight -->
		<npc id="20956" x="110692" y="-1224" z="-4008" heading="0" respawnDelay="37" /> <!-- Past Knight -->
		<npc id="20956" x="112353" y="-1172" z="-3908" heading="24036" respawnDelay="37" /> <!-- Past Knight -->
		<npc id="20956" x="113524" y="-5522" z="-3884" heading="0" respawnDelay="37" /> <!-- Past Knight -->
		<npc id="20956" x="113524" y="-5166" z="-3884" heading="0" respawnDelay="37" /> <!-- Past Knight -->
		<npc id="20956" x="114877" y="-367" z="-3615" heading="26346" respawnDelay="37" /> <!-- Past Knight -->
		<npc id="20956" x="114966" y="-8048" z="-3536" heading="0" respawnDelay="37" /> <!-- Past Knight -->
		<npc id="20956" x="115738" y="-862" z="-3568" heading="56275" respawnDelay="37" /> <!-- Past Knight -->
		<npc id="20956" x="116529" y="-1337" z="-3637" heading="555" respawnDelay="37" /> <!-- Past Knight -->
		<npc id="20956" x="117556" y="-370" z="-3607" heading="23902" respawnDelay="37" /> <!-- Past Knight -->
		<npc id="20956" x="117984" y="-8164" z="-3664" heading="0" respawnDelay="37" /> <!-- Past Knight -->
		<npc id="20956" x="118070" y="-10108" z="-3336" heading="0" respawnDelay="37" /> <!-- Past Knight -->
		<npc id="20956" x="119084" y="-3540" z="-3892" heading="0" respawnDelay="37" /> <!-- Past Knight -->
		<npc id="20956" x="119726" y="-1193" z="-3723" heading="1922" respawnDelay="37" /> <!-- Past Knight -->
		<npc id="20956" x="119750" y="-9600" z="-3484" heading="0" respawnDelay="37" /> <!-- Past Knight -->
		<npc id="20956" x="120112" y="-4774" z="-4100" heading="0" respawnDelay="37" /> <!-- Past Knight -->
		<npc id="20956" x="120616" y="-4952" z="-4100" heading="0" respawnDelay="37" /> <!-- Past Knight -->
		<npc id="20956" x="121916" y="-5392" z="-3876" heading="0" respawnDelay="37" /> <!-- Past Knight -->
		<npc id="20956" x="123020" y="-6468" z="-3832" heading="0" respawnDelay="37" /> <!-- Past Knight -->
		<npc id="20959" x="124862" y="-10414" z="-3908" heading="0" respawnDelay="37" /> <!-- Dark Guard -->
		<npc id="20959" x="126163" y="-1353" z="-2376" heading="18529" respawnDelay="37" /> <!-- Dark Guard -->
		<npc id="20959" x="126499" y="-7972" z="-3804" heading="24953" respawnDelay="37" /> <!-- Dark Guard -->
		<npc id="20959" x="126711" y="-3499" z="-3013" heading="18124" respawnDelay="37" /> <!-- Dark Guard -->
		<npc id="20959" x="127789" y="-5551" z="-3289" heading="6311" respawnDelay="37" /> <!-- Dark Guard -->
		<npc id="20959" x="127914" y="-13326" z="-3852" heading="0" respawnDelay="37" /> <!-- Dark Guard -->
		<npc id="20959" x="128015" y="-13504" z="-3852" heading="0" respawnDelay="37" /> <!-- Dark Guard -->
		<npc id="20959" x="128440" y="-12456" z="-3792" heading="0" respawnDelay="37" /> <!-- Dark Guard -->
		<npc id="20959" x="128839" y="-11180" z="-3772" heading="0" respawnDelay="37" /> <!-- Dark Guard -->
		<npc id="20959" x="129041" y="-11536" z="-3772" heading="0" respawnDelay="37" /> <!-- Dark Guard -->
		<npc id="20959" x="129734" y="-7742" z="-3872" heading="55835" respawnDelay="37" /> <!-- Dark Guard -->
		<npc id="20963" x="113423" y="-5344" z="-3884" heading="0" respawnDelay="37" /> <!-- Bloody Lord -->
		<npc id="20963" x="114865" y="-7514" z="-3536" heading="0" respawnDelay="37" /> <!-- Bloody Lord -->
		<npc id="20963" x="115167" y="-8048" z="-3536" heading="0" respawnDelay="37" /> <!-- Bloody Lord -->
		<npc id="20963" x="117984" y="-7808" z="-3664" heading="0" respawnDelay="37" /> <!-- Bloody Lord -->
		<npc id="20963" x="118070" y="-9752" z="-3336" heading="0" respawnDelay="37" /> <!-- Bloody Lord -->
		<npc id="20963" x="119084" y="-3184" z="-3892" heading="0" respawnDelay="37" /> <!-- Bloody Lord -->
		<npc id="20963" x="119548" y="-9244" z="-3484" heading="0" respawnDelay="37" /> <!-- Bloody Lord -->
		<npc id="20963" x="119587" y="-3362" z="-3892" heading="0" respawnDelay="37" /> <!-- Bloody Lord -->
		<npc id="20963" x="119851" y="-9066" z="-3484" heading="0" respawnDelay="37" /> <!-- Bloody Lord -->
		<npc id="20963" x="120717" y="-4774" z="-4100" heading="0" respawnDelay="37" /> <!-- Bloody Lord -->
		<npc id="20963" x="121815" y="-4858" z="-3876" heading="0" respawnDelay="37" /> <!-- Bloody Lord -->
		<npc id="20963" x="122017" y="-5214" z="-3876" heading="0" respawnDelay="37" /> <!-- Bloody Lord -->
		<npc id="20963" x="122617" y="-6112" z="-3832" heading="0" respawnDelay="37" /> <!-- Bloody Lord -->
		<npc id="20963" x="123174" y="-5018" z="-3404" heading="0" respawnDelay="37" /> <!-- Bloody Lord -->
		<npc id="20963" x="124560" y="-10592" z="-3908" heading="0" respawnDelay="37" /> <!-- Bloody Lord -->
		<npc id="20963" x="125609" y="-2492" z="-2772" heading="0" respawnDelay="37" /> <!-- Bloody Lord -->
		<npc id="20963" x="126355" y="-4239" z="-3211" heading="28063" respawnDelay="37" /> <!-- Bloody Lord -->
		<npc id="20963" x="127612" y="-13504" z="-3852" heading="0" respawnDelay="37" /> <!-- Bloody Lord -->
		<npc id="20963" x="128203" y="-1678" z="-2178" heading="9310" respawnDelay="37" /> <!-- Bloody Lord -->
		<npc id="20963" x="128638" y="-11180" z="-3772" heading="0" respawnDelay="37" /> <!-- Bloody Lord -->
		<npc id="20963" x="129041" y="-10824" z="-3772" heading="0" respawnDelay="37" /> <!-- Bloody Lord -->
		<npc id="20963" x="130917" y="-6675" z="-3547" heading="1535" respawnDelay="37" /> <!-- Bloody Lord -->
		<npc id="31651" x="119472" y="-28688" z="-3776" heading="7000" respawnDelay="60" /> <!-- Tablet of Vision -->
	</spawn>
</list>